{
  "schema_version": 1,
  "family_id": "if_mib_interfaces",
  "query": {
    "path": "resource/snmp_queries/interface.xml",
    "sha256": "f9119258af2b3a0e33d72ad0c04f71bee8c07965674c342914e5bde696f2e8ad",
    "root": "interface",
    "header": [
      {
        "key": "name",
        "value": "Get SNMP Interfaces"
      },
      {
        "key": "description",
        "value": "Queries a host for a list of monitorable interfaces"
      },
      {
        "key": "oid_index",
        "value": ".1.3.6.1.2.1.2.2.1.1"
      },
      {
        "key": "oid_num_indexes",
        "value": ".1.3.6.1.2.1.2.1.0"
      },
      {
        "key": "index_order",
        "value": "ifName:ifDescr:ifHwAddr:ifIndex"
      },
      {
        "key": "index_order_type",
        "value": "numeric"
      },
      {
        "key": "index_title_format",
        "value": "|chosen_order_field|"
      }
    ],
    "fields": [
      {
        "name": "ifIndex",
        "properties": [
          {
            "key": "name",
            "value": "Index"
          },
          {
            "key": "method",
            "value": "walk"
          },
          {
            "key": "source",
            "value": "value"
          },
          {
            "key": "direction",
            "value": "input"
          },
          {
            "key": "oid",
            "value": ".1.3.6.1.2.1.2.2.1.1"
          }
        ]
      },
      {
        "name": "ifOperStatus",
        "properties": [
          {
            "key": "name",
            "value": "Status"
          },
          {
            "key": "method",
            "value": "walk"
          },
          {
            "key": "source",
            "value": "VALUE/REGEXP:[a-zA-Z]{1,}\\(([1-]{1})+\\)$"
          },
          {
            "key": "direction",
            "value": "input-output"
          },
          {
            "key": "oid",
            "value": ".1.3.6.1.2.1.2.2.1.8"
          }
        ]
      },
      {
        "name": "ifAdminStatus",
        "properties": [
          {
            "key": "name",
            "value": "AdminStatus"
          },
          {
            "key": "method",
            "value": "walk"
          },
          {
            "key": "source",
            "value": "VALUE/REGEXP:[a-zA-Z]{1,}\\(([1-]{1})+\\)$"
          },
          {
            "key": "direction",
            "value": "input-output"
          },
          {
            "key": "oid",
            "value": ".1.3.6.1.2.1.2.2.1.7"
          }
        ]
      },
      {
        "name": "ifDescr",
        "properties": [
          {
            "key": "name",
            "value": "Description"
          },
          {
            "key": "method",
            "value": "walk"
          },
          {
            "key": "output_format",
            "value": "ascii"
          },
          {
            "key": "source",
            "value": "value"
          },
          {
            "key": "direction",
            "value": "input"
          },
          {
            "key": "oid",
            "value": ".1.3.6.1.2.1.2.2.1.2"
          }
        ]
      },
      {
        "name": "ifName",
        "properties": [
          {
            "key": "name",
            "value": "Name (IF-MIB)"
          },
          {
            "key": "method",
            "value": "walk"
          },
          {
            "key": "output_format",
            "value": "ascii"
          },
          {
            "key": "source",
            "value": "value"
          },
          {
            "key": "direction",
            "value": "input"
          },
          {
            "key": "oid",
            "value": ".1.3.6.1.2.1.31.1.1.1.1"
          }
        ]
      },
      {
        "name": "ifAlias",
        "properties": [
          {
            "key": "name",
            "value": "Alias (IF-MIB)"
          },
          {
            "key": "method",
            "value": "walk"
          },
          {
            "key": "output_format",
            "value": "ascii"
          },
          {
            "key": "source",
            "value": "value"
          },
          {
            "key": "direction",
            "value": "input"
          },
          {
            "key": "oid",
            "value": ".1.3.6.1.2.1.31.1.1.1.18"
          }
        ]
      },
      {
        "name": "ifType",
        "properties": [
          {
            "key": "name",
            "value": "Type"
          },
          {
            "key": "method",
            "value": "walk"
          },
          {
            "key": "output_format",
            "value": "ascii"
          },
          {
            "key": "source",
            "value": "value"
          },
          {
            "key": "direction",
            "value": "input"
          },
          {
            "key": "oid",
            "value": ".1.3.6.1.2.1.2.2.1.3"
          }
        ]
      },
      {
        "name": "ifSpeed",
        "properties": [
          {
            "key": "name",
            "value": "Speed"
          },
          {
            "key": "method",
            "value": "walk"
          },
          {
            "key": "source",
            "value": "value"
          },
          {
            "key": "direction",
            "value": "input"
          },
          {
            "key": "oid",
            "value": ".1.3.6.1.2.1.2.2.1.5"
          }
        ]
      },
      {
        "name": "ifHighSpeed",
        "properties": [
          {
            "key": "name",
            "value": "High Speed"
          },
          {
            "key": "method",
            "value": "walk"
          },
          {
            "key": "source",
            "value": "value"
          },
          {
            "key": "direction",
            "value": "input-output"
          },
          {
            "key": "oid",
            "value": ".1.3.6.1.2.1.31.1.1.1.15"
          }
        ]
      },
      {
        "name": "ifHwAddr",
        "properties": [
          {
            "key": "name",
            "value": "Hardware Address"
          },
          {
            "key": "method",
            "value": "walk"
          },
          {
            "key": "output_format",
            "value": "hex"
          },
          {
            "key": "source",
            "value": "value"
          },
          {
            "key": "direction",
            "value": "input"
          },
          {
            "key": "oid",
            "value": ".1.3.6.1.2.1.2.2.1.6"
          }
        ]
      },
      {
        "name": "ifInOctets",
        "properties": [
          {
            "key": "name",
            "value": "Bytes In"
          },
          {
            "key": "method",
            "value": "walk"
          },
          {
            "key": "source",
            "value": "value"
          },
          {
            "key": "direction",
            "value": "output"
          },
          {
            "key": "oid",
            "value": ".1.3.6.1.2.1.2.2.1.10"
          }
        ]
      },
      {
        "name": "ifOutOctets",
        "properties": [
          {
            "key": "name",
            "value": "Bytes Out"
          },
          {
            "key": "method",
            "value": "walk"
          },
          {
            "key": "source",
            "value": "value"
          },
          {
            "key": "direction",
            "value": "output"
          },
          {
            "key": "oid",
            "value": ".1.3.6.1.2.1.2.2.1.16"
          }
        ]
      },
      {
        "name": "ifHCInOctets",
        "properties": [
          {
            "key": "name",
            "value": "Bytes In - 64-bit Counters"
          },
          {
            "key": "method",
            "value": "walk"
          },
          {
            "key": "source",
            "value": "value"
          },
          {
            "key": "direction",
            "value": "output"
          },
          {
            "key": "oid",
            "value": ".1.3.6.1.2.1.31.1.1.1.6"
          }
        ]
      },
      {
        "name": "ifHCOutOctets",
        "properties": [
          {
            "key": "name",
            "value": "Bytes Out - 64-bit Counters"
          },
          {
            "key": "method",
            "value": "walk"
          },
          {
            "key": "source",
            "value": "value"
          },
          {
            "key": "direction",
            "value": "output"
          },
          {
            "key": "oid",
            "value": ".1.3.6.1.2.1.31.1.1.1.10"
          }
        ]
      },
      {
        "name": "ifInOctetsIPv4",
        "properties": [
          {
            "key": "name",
            "value": "IPv4 Bytes In"
          },
          {
            "key": "method",
            "value": "walk"
          },
          {
            "key": "source",
            "value": "value"
          },
          {
            "key": "direction",
            "value": "output"
          },
          {
            "key": "oid",
            "value": ".1.3.6.1.2.1.4.31.3.1.5.1"
          }
        ]
      },
      {
        "name": "ifOutOctetsIPv4",
        "properties": [
          {
            "key": "name",
            "value": "IPv4 Bytes Out"
          },
          {
            "key": "method",
            "value": "walk"
          },
          {
            "key": "source",
            "value": "value"
          },
          {
            "key": "direction",
            "value": "output"
          },
          {
            "key": "oid",
            "value": ".1.3.6.1.2.1.4.31.3.1.32.1"
          }
        ]
      },
      {
        "name": "ifHCInOctetsIPv4",
        "properties": [
          {
            "key": "name",
            "value": "IPv4 Bytes In - 64-bit Counters"
          },
          {
            "key": "method",
            "value": "walk"
          },
          {